{
 "id": "VR-20261015T053419Z-werken-be-request",
 "artifactId": "1be48754-5db8-5188-86c1-266742b5cd3e",
 "artifactType": "opportunity-map-request",
 "levels": {
  "V0": {
   "status": "pass",
   "checks": [
    {
     "id": "v0-schema-opportunity-map-request",
     "status": "pass",
     "detail": "1/1 artifact(s) valid against opportunity-map-request.schema.json"
    }
   ]
  },
  "V1": {
   "status": "not_applicable",
   "checks": [],
   "notes": "V1 not evaluated for this artifact"
  },
  "V2": {
   "status": "not_applicable",
   "checks": [],
   "notes": "V2 not evaluated for this artifact"
  },
  "V3": {
   "status": "not_applicable",
   "checks": [],
   "notes": "V3 not evaluated for this artifact"
  },
  "V4": {
   "status": "pending",
   "checks": [],
   "notes": "V4 human-expert validation (HITL) is pending by design; the deterministic PoC cannot sign it."
  }
 },
 "verdict": "pass",
 "evaluatorRun": "critic-validator#deterministic-v0-v3-poc1",
 "evaluatedAt": "2026-10-15T05:34:20Z"
}
