{
 "id": "VR-20261015T054316Z-landschap-be-normcards",
 "artifactId": "normcards-landschap-be",
 "artifactType": "norm-card-set",
 "levels": {
  "V0": {
   "status": "pass",
   "checks": [
    {
     "id": "v0-schema-norm-card",
     "status": "pass",
     "detail": "2/2 artifact(s) valid against norm-card.schema.json"
    }
   ]
  },
  "V2": {
   "status": "pass",
   "checks": [
    {
     "id": "v2-card-citations",
     "status": "pass",
     "detail": "all 2 NormCard(s) carry docId+article+version+verbatim quote+uri"
    }
   ]
  },
  "V1": {
   "status": "not_applicable",
   "checks": [],
   "notes": "V1 not evaluated for this artifact"
  },
  "V3": {
   "status": "not_applicable",
   "checks": [],
   "notes": "V3 not evaluated for this artifact"
  },
  "V4": {
   "status": "pending",
   "checks": [],
   "notes": "V4 human-expert validation (HITL) is pending by design; the deterministic PoC cannot sign it."
  }
 },
 "verdict": "pass",
 "evaluatorRun": "critic-validator#deterministic-v0-v3-poc1",
 "evaluatedAt": "2026-10-15T05:43:16Z"
}
