{
 "id": "VR-20261014T185506Z-energietoets-be-pipeline",
 "artifactId": "20261014T185506Z-energietoets-be",
 "artifactType": "pipeline-run",
 "levels": {
  "V0": {
   "status": "pass",
   "checks": [
    {
     "id": "v0-schema-opportunity-map-request",
     "status": "pass",
     "detail": "1/1 artifact(s) valid against opportunity-map-request.schema.json"
    },
    {
     "id": "v0-schema-norm-card",
     "status": "pass",
     "detail": "4/4 artifact(s) valid against norm-card.schema.json"
    },
    {
     "id": "v0-schema-formal-rule",
     "status": "pass",
     "detail": "4/4 artifact(s) valid against formal-rule.schema.json"
    },
    {
     "id": "v0-schema-zone-result",
     "status": "pass",
     "detail": "3/3 artifact(s) valid against zone-result.schema.json"
    },
    {
     "id": "v0-schema-decision-table",
     "status": "pass",
     "detail": "1/1 artifact(s) valid against decision-table.schema.json"
    }
   ]
  },
  "V1": {
   "status": "pass",
   "checks": [
    {
     "id": "v1-output-geometry-valid",
     "status": "pass",
     "detail": "all 3 zone geometries valid (shapely is_valid)"
    },
    {
     "id": "v1-output-crs-and-bounds",
     "status": "pass",
     "detail": "all payloads EPSG:4326 with coordinates inside NL bounds lon(3.0, 7.5)/lat(50.5, 54.0)"
    },
    {
     "id": "v1-input-layers-crs",
     "status": "pass",
     "detail": "1 input layer(s) declare a recognised CRS member (EPSG:28992 computation CRS)"
    },
    {
     "id": "v1-input-invalid-census",
     "status": "pass",
     "detail": "no invalid as-served features in any input layer",
     "evidenceRefs": [
      "aoi"
     ]
    },
    {
     "id": "v1-final-zone-sanity",
     "status": "pass",
     "detail": "final zone non-empty, valid, 536.017 km2 <= AOI 536.017 km2 and <= inclusion union 536.017 km2",
     "evidenceRefs": [
      "ZR-final-c0333e3f54"
     ]
    }
   ]
  },
  "V2": {
   "status": "pass",
   "checks": [
    {
     "id": "v2-rule-card-linkage",
     "status": "pass",
     "detail": "all 4 FormalRule(s) link an existing NormCard (cite-or-abstain chain intact)"
    },
    {
     "id": "v2-card-citations",
     "status": "pass",
     "detail": "all 4 NormCard(s) carry docId+article+version+verbatim quote+uri"
    },
    {
     "id": "v2-zone-rule-traceability",
     "status": "pass",
     "detail": "every zone ruleId traces to a formalized rule (1 available)"
    },
    {
     "id": "v2-decision-table-linkage",
     "status": "pass",
     "detail": "all 4 decision-table row(s) link an existing NormCard"
    },
    {
     "id": "v2-executable-refs-registered",
     "status": "pass",
     "detail": "all executableRefs are registered deterministic engine operations (6 registered)"
    }
   ]
  },
  "V3": {
   "status": "pass",
   "checks": [
    {
     "id": "v3-reexecution-agreement",
     "status": "pass",
     "detail": "independent geopandas re-execution of 1 rule(s): pipeline 536.017 km2 vs independent 536.017 km2; relative area delta 4.448e-16 (threshold 0.01); IoU 1.000000 (threshold 0.98)"
    }
   ]
  },
  "V4": {
   "status": "pending",
   "checks": [],
   "notes": "V4 human-expert validation (HITL) is pending by design; the deterministic PoC cannot sign it."
  }
 },
 "verdict": "pass",
 "evaluatorRun": "critic-validator#deterministic-v0-v3-poc1",
 "evaluatedAt": "2026-10-14T18:55:06Z",
 "evidence": [
  {
   "ref": "38640a01-878b-5efc-a49d-331df0b28798",
   "note": "OpportunityMapRequest"
  },
  {
   "ref": "normcards-energietoets-be",
   "note": "4 NormCards"
  },
  {
   "ref": "formalrules-energietoets-be",
   "note": "4 FormalRules"
  },
  {
   "ref": "zones",
   "note": "3 ZoneResults"
  },
  {
   "ref": "DT-energietoets-be-nspd",
   "note": "DecisionTable"
  }
 ]
}
