{
 "id": "VR-20261015T054309Z-bos-nl-decisiontable",
 "artifactId": "DT-bos-nl-nspd",
 "artifactType": "decision-table",
 "levels": {
  "V0": {
   "status": "pass",
   "checks": [
    {
     "id": "v0-schema-decision-table",
     "status": "pass",
     "detail": "1/1 artifact(s) valid against decision-table.schema.json"
    }
   ]
  },
  "V2": {
   "status": "pass",
   "checks": [
    {
     "id": "v2-decision-table-linkage",
     "status": "pass",
     "detail": "all 4 decision-table row(s) link an existing NormCard"
    }
   ]
  },
  "V1": {
   "status": "not_applicable",
   "checks": [],
   "notes": "V1 not evaluated for this artifact"
  },
  "V3": {
   "status": "not_applicable",
   "checks": [],
   "notes": "V3 not evaluated for this artifact"
  },
  "V4": {
   "status": "pending",
   "checks": [],
   "notes": "V4 human-expert validation (HITL) is pending by design; the deterministic PoC cannot sign it."
  }
 },
 "verdict": "pass",
 "evaluatorRun": "critic-validator#deterministic-v0-v3-poc1",
 "evaluatedAt": "2026-10-15T05:43:09Z"
}
