{
 "id": "VR-20261016T144620Z-water-nl-formalrules",
 "artifactId": "formalrules-water-nl",
 "artifactType": "formal-rule-set",
 "levels": {
  "V0": {
   "status": "pass",
   "checks": [
    {
     "id": "v0-schema-formal-rule",
     "status": "pass",
     "detail": "4/4 artifact(s) valid against formal-rule.schema.json"
    }
   ]
  },
  "V2": {
   "status": "pass",
   "checks": [
    {
     "id": "v2-rule-card-linkage",
     "status": "pass",
     "detail": "all 4 FormalRule(s) link an existing NormCard (cite-or-abstain chain intact)"
    },
    {
     "id": "v2-executable-refs-registered",
     "status": "pass",
     "detail": "all executableRefs are registered deterministic engine operations (6 registered)"
    }
   ]
  },
  "V1": {
   "status": "not_applicable",
   "checks": [],
   "notes": "V1 not evaluated for this artifact"
  },
  "V3": {
   "status": "not_applicable",
   "checks": [],
   "notes": "V3 not evaluated for this artifact"
  },
  "V4": {
   "status": "pending",
   "checks": [],
   "notes": "V4 human-expert validation (HITL) is pending by design; the deterministic PoC cannot sign it."
  }
 },
 "verdict": "pass",
 "evaluatorRun": "critic-validator#deterministic-v0-v3-poc1",
 "evaluatedAt": "2026-10-16T14:46:21Z"
}
