{
 "id": "VR-scenario-run",
 "artifactId": "SR-20260830T113234Z-wind-20260831T074521Z",
 "artifactType": "scenario-report",
 "levels": {
  "V0": {
   "status": "pass",
   "checks": [
    {
     "id": "v0-scenario-report-schema",
     "status": "pass",
     "detail": "scenario-report validated against scenario-report.schema.json"
    }
   ]
  },
  "V1": {
   "status": "pass",
   "checks": [
    {
     "id": "v1-final-geometry-sc-w-nnn-exception",
     "status": "pass",
     "detail": "final zone geometryValid=True, status=ok",
     "evidenceRefs": [
      "scenarios/SC-W-NNN-EXCEPTION.geojson"
     ]
    },
    {
     "id": "v1-final-geometry-sc-w-stilte-hard",
     "status": "pass",
     "detail": "final zone geometryValid=True, status=ok",
     "evidenceRefs": [
      "scenarios/SC-W-STILTE-HARD.geojson"
     ]
    },
    {
     "id": "v1-final-geometry-sc-w-aandacht-500",
     "status": "pass",
     "detail": "final zone geometryValid=True, status=ok",
     "evidenceRefs": [
      "scenarios/SC-W-AANDACHT-500.geojson"
     ]
    },
    {
     "id": "v1-final-geometry-sc-w-aandacht-1500",
     "status": "pass",
     "detail": "final zone geometryValid=True, status=ok",
     "evidenceRefs": [
      "scenarios/SC-W-AANDACHT-1500.geojson"
     ]
    },
    {
     "id": "v1-final-geometry-sc-w-aandacht-3000",
     "status": "pass",
     "detail": "final zone geometryValid=True, status=ok",
     "evidenceRefs": [
      "scenarios/SC-W-AANDACHT-3000.geojson"
     ]
    },
    {
     "id": "v1-final-geometry-sc-w-natura-setback",
     "status": "pass",
     "detail": "final zone geometryValid=True, status=ok",
     "evidenceRefs": [
      "scenarios/SC-W-NATURA-SETBACK.geojson"
     ]
    }
   ]
  },
  "V2": {
   "status": "pass",
   "checks": [
    {
     "id": "v2-mutation-rule-ids",
     "status": "pass",
     "detail": "every mutation ruleId resolved in the baseline formalrules set (skipped mutations carry recorded reasons)"
    },
    {
     "id": "v2-basis-normcard-ids",
     "status": "pass",
     "detail": "every norm_variance/policy_variant normCardId resolved in the baseline run's normcards.json"
    },
    {
     "id": "v2-narrative-grounding",
     "status": "pass",
     "detail": "every number and id in the narration resolves to the report"
    }
   ]
  },
  "V3": {
   "status": "pass",
   "checks": [
    {
     "id": "v3-control-reproduction",
     "status": "pass",
     "detail": "control final 859.462827229 km2 vs baseline 859.462827229 km2 (rel delta 0.0, tolerance 0.001); 9 rules executed"
    }
   ]
  },
  "V4": {
   "status": "pending",
   "notes": "scenario choice remains a human decision; this report is decision support, never a decision"
  }
 },
 "verdict": "pass",
 "evidence": [
  {
   "ref": "scenario-report.json",
   "note": "the swept report this verdict gates"
  },
  {
   "ref": "validation.json",
   "note": "this report"
  }
 ],
 "evaluatorRun": "scenario-critic#poc-v0.1",
 "evaluatedAt": "2026-08-31T07:46:04Z"
}
